{
  "record_id": "record-mcp-example-001",
  "record_schema_version": "candidate-record-v0.1",
  "trace_id": "mcp-trace-example-001",
  "system": {
    "agent_id": "agent-auth-1",
    "version": "1.0.0"
  },
  "actors": [
    {
      "actor_id": "user-2",
      "kind": "human",
      "role": "principal"
    },
    {
      "actor_id": "agent-auth-1",
      "kind": "agent",
      "role": "delegate"
    }
  ],
  "authority": {
    "principal": "user-2",
    "delegate": "agent-auth-1",
    "scope": [
      "send_email"
    ],
    "prohibited": [],
    "valid_from": "2026-09-18T07:00:00Z",
    "valid_until": "2026-09-18T07:30:00Z"
  },
  "sources": [],
  "events": [
    {
      "event_id": "mcp-request:req-1",
      "occurred_at": "2026-09-18T07:05:00Z",
      "actor_id": "agent-auth-1",
      "operation": "send_email",
      "status": "completed",
      "authorization": "approved",
      "authorization_decided_at": "2026-09-18T07:04:30Z",
      "consequential": true,
      "material": true
    }
  ],
  "verification": {
    "state": "pending"
  },
  "incidents": [],
  "integrity": {
    "generated_at": "2026-09-18T07:10:00Z"
  },
  "notes": "Adapted by mcp-2026-v0.1 from MCP 2026-07-28 request/response capture. clientInfo/serverInfo are self-reported descriptive metadata and are not used as security identity or authorization evidence."
}
